[
  {
    "name": "Aisha Rahman",
    "target_role": "UX Designer",
    "target_org": "Atelier Interactive",
    "prev_orgs": [
      "PixelFlow Studio"
    ],
    "skills": [
      "empathetic",
      "research-driven",
      "imaginative",
      "data-minded"
    ],
    "traits": [
      "collaborative",
      "analytical",
      "creative"
    ],
    "motivations": [
      "thoughtful design can influence emotion and behavior"
    ],
    "preferences": [
      "collaborative culture"
    ],
    "raw_text": "Dear Creative Director,\n\nMy name is Aisha Rahman, and I am applying for the UX Designer position at Atelier Interactive. I’ve always been fascinated by the intersection of art and technology — how thoughtful design can influence emotion and behavior. At PixelFlow Studio, I redesigned the mobile onboarding flow for a lifestyle app, increasing user retention by 25%.\n\nMy approach to design is empathetic and research-driven. I enjoy listening to users, interpreting subtle feedback, and turning those insights into intuitive experiences. I’m imaginative but also data-minded — balancing aesthetics with measurable usability.\n\nI admire Atelier’s bold design philosophy and collaborative culture, and I believe my blend of creativity and analytical thinking will fit well within your team.",
    "id": "letter_001"
  },
  {
    "name": "Daniel Koh",
    "target_role": "Research Scientist",
    "target_org": "BioSense Institute",
    "prev_orgs": [
      "previous lab"
    ],
    "skills": [
      "analytical",
      "experimental",
      "machine learning",
      "refining models"
    ],
    "traits": [
      "curious",
      "meticulous",
      "calm focus under pressure"
    ],
    "motivations": [
      "contributing to discoveries that improve human health"
    ],
    "preferences": [
      "interdisciplinary environment"
    ],
    "raw_text": "Dear Dr. Lee,\n\nMy name is Daniel Koh, and I am excited to apply for the Research Scientist position at BioSense Institute. My academic background in biomedical signal processing has equipped me with strong analytical and experimental skills. At my previous lab, I led a small team in designing machine learning models to detect early cardiac anomalies from biosensor data.\n\nI’m deeply curious and meticulous by nature, often spending long hours refining models until they meet clinical standards. I value integrity and precision in research and find motivation in contributing to discoveries that improve human health. My peers often note my calm focus under pressure and my dedication to reproducible results.\n\nI believe BioSense’s interdisciplinary environment will allow me to expand both my technical and scientific horizons.",
    "id": "letter_002"
  },
  {
    "name": "Evelyn Tan",
    "target_role": "Data Analyst",
    "target_org": "Nova Insights",
    "prev_orgs": [
      "Bright Metrics"
    ],
    "skills": [
      "Python",
      "data analysis",
      "pattern recognition",
      "automation"
    ],
    "traits": [
      "curious",
      "detail-oriented",
      "patient",
      "methodical"
    ],
    "motivations": [
      "uncovering patterns in complex datasets",
      "translating data into meaningful business strategies"
    ],
    "preferences": [
      "collaboration",
      "diverse opinions"
    ],
    "raw_text": "Dear Hiring Manager,\n\nMy name is Evelyn Tan, and I am writing to express my interest in the Data Analyst position at Nova Insights. I have always enjoyed uncovering patterns in complex datasets and translating them into meaningful business strategies. During my internship at Bright Metrics, I developed Python scripts to automate data cleaning, which improved processing efficiency by 30%.\n\nI’m a naturally curious and detail-oriented person who thrives on solving analytical challenges. My colleagues describe me as patient and methodical, always double-checking results before drawing conclusions. I value collaboration and often seek diverse opinions to strengthen my insights.\n\nI’m excited about Nova’s focus on data-driven innovation and would love to contribute to projects that blend creativity with analytical depth.",
    "id": "letter_003"
  },
  {
    "name": "Jonathan Lim",
    "target_role": null,
    "target_org": "Vertex Dynamics",
    "prev_orgs": [
      "NexaTech"
    ],
    "skills": [
      "leadership",
      "organizational skills",
      "structured",
      "adaptable",
      "clear communication"
    ],
    "traits": [
      "proactive planning",
      "calm and supportive presence"
    ],
    "motivations": [
      "bring leadership and organizational skills",
      "deliver complex projects with precision"
    ],
    "preferences": [
      "anticipating problems rather than reacting to them",
      "human-centered teamwork"
    ],
    "raw_text": "Dear Hiring Committee,\n\nMy name is Jonathan Lim, and with five years of experience managing cross-functional projects, I am eager to bring my leadership and organizational skills to Vertex Dynamics. In my previous role at NexaTech, I oversaw software rollout initiatives involving coordination across engineering, QA, and client teams.\n\nI’m a structured yet adaptable professional who values transparency, accountability, and clear communication. My personality leans toward proactive planning — I prefer anticipating problems rather than reacting to them. At the same time, I try to maintain a calm and supportive presence when unexpected challenges arise.\n\nVertex’s reputation for delivering complex projects with precision resonates with my own philosophy of disciplined execution and human-centered teamwork.",
    "id": "letter_004"
  },
  {
    "name": "Marcus Lee",
    "target_role": "Software Engineer",
    "target_org": "Lumina Systems",
    "prev_orgs": [
      "CloudNext"
    ],
    "skills": [
      "Node.js",
      "React",
      "backend APIs",
      "user-centered design",
      "clean code"
    ],
    "traits": [
      "disciplined",
      "self-motivated",
      "empathetic",
      "clear"
    ],
    "motivations": [
      "contribute to scalable, high-impact projects",
      "turn abstract ideas into tangible products"
    ],
    "preferences": [
      "independent problem-solving",
      "brainstorming with teammates"
    ],
    "raw_text": "Dear Recruitment Team,\n\nMy name is Marcus Lee, and I’m a Software Engineer with a passion for clean code and user-centered design. I am eager to join Lumina Systems to contribute to scalable, high-impact projects. My previous experience at CloudNext involved developing backend APIs in Node.js and integrating them with React interfaces for internal dashboards.\n\nI’m a highly disciplined and self-motivated developer who finds joy in turning abstract ideas into tangible products. I believe empathy and clarity are just as important as logic in programming. My work style is organized but flexible — I enjoy both independent problem-solving and brainstorming with teammates.\n\nWhat excites me about Lumina is its commitment to continuous learning and mentorship, values that align perfectly with my own approach to growth and innovation.",
    "id": "letter_005"
  }
]